{
  "schema_version": 1,
  "attempt_id": "12345678-1234-1234-1234-123456789abc",
  "source_fingerprint": "aaaaaaaaaaaaaaaaaaaaaaaaaaaaaaaaaaaaaaaaaaaaaaaaaaaaaaaaaaaaaaaa",
  "parameters_hash": "bbbbbbbbbbbbbbbbbbbbbbbbbbbbbbbbbbbbbbbbbbbbbbbbbbbbbbbbbbbbbbbb",
  "created_at": "2026-07-31T18:00:00Z",
  "expires_at": "2026-08-07T18:00:00Z",
  "chunks": [
    {
      "id": 0,
      "start_ms": 0,
      "end_ms": 2400000,
      "state": "confirmed",
      "attempts": 1,
      "result_ref": "chunk-0.dpapi"
    },
    {
      "id": 1,
      "start_ms": 2398000,
      "end_ms": 4800000,
      "state": "pending",
      "attempts": 0,
      "result_ref": null
    }
  ]
}
